section_id,subsection_id,paragraph_id,sentence_id,sentence_text,sentence_position,dominant_function,secondary_function,previous_sentence_relation,next_sentence_relation,claim_type,claim_strength,evidence_anchor,citation_anchor,figure_table_anchor,technical_terms,hedging_words,risk_words,punctuation_pattern,sentence_skeleton,expected_topvenue_role,mismatch_type,revision_operation
Reduced-XOR Counterfactuals,,REDUCED_XOR_COUNTERFACTUALS.P3,REDUCED_XOR_COUNTERFACTUALS.P3.S2,Run02 covers all eight same-data-RO directions and all eight complements; the all64 run02 row is retained as the corresponding final-output repeat context.} tab:reducedxor { }{!}{ {tabular}{lllrrrrr} Mode & Direction & Label & $p_1$ r01 & Signed bias r01 & Min-H r01 & Worst $x$ r01 & $p_1$ r02 \\ all64 & all & all64 & 0.458617 & -0.041383 & 0.885279 & 590 & 0.443194 \\ data\_ro & 0 & data\_ro0 & 0.191877 & -0.308123 & 0.307353 & 897 & 0.182267 \\ data\_ro & 1 & data\_ro1 & 0.518915 & 0.018915 & 0.946430 & 632 & 0.522621 \\ data\_ro & 2 & data\_ro2 & 0.244002 & -0.255998 & 0.403546 & 847 & 0.245911 \\ data\_ro & 3 & data\_ro3 & 0.671833 & 0.171833 & 0.573825 & 804 & 0.671545 \\ data\_ro & 4 & data\_ro4 & 0.424639 & -0.075361 & 0.797461 & 807 & 0.427625 \\ data\_ro & 5 & data\_ro5 & 0.409454 & -0.090546 & 0.759879 & 806 & 0.405413 \\ data\_ro & 6 & data\_ro6 & 0.375380 & -0.124620 & 0.678949 & 839 & 0.375746 \\ data\_ro & 7 & data\_ro7 & 0.549958 & 0.049958 & 0.862607 & 644 & 0.547275 \\ except\_data\_ro & 0 & except\_ro0 & 0.501020 & 0.001020 & 0.997060 & 571 & 0.500956 \\ except\_data\_ro & 1 & except\_ro1 & 0.550312 & 0.050312 & 0.861678 & 597 & 0.553538 \\ except\_data\_ro & 2 & except\_ro2 & 0.499674 & -0.000326 & 0.999060 & 557 & 0.499543 \\ except\_data\_ro & 3 & except\_ro3 & 0.553930 & 0.053930 & 0.852224 & 603 & 0.553217 \\ except\_data\_ro & 4 & except\_ro4 & 0.520205 & 0.020205 & 0.942848 & 570 & 0.519451 \\ except\_data\_ro & 5 & except\_ro5 & 0.565521 & 0.065521 & 0.822347 & 620 & 0.566377 \\ except\_data\_ro & 6 & except\_ro6 & 0.501833 & 0.001833 & 0.994721 & 556 & 0.500471 \\ except\_data\_ro & 7 & except\_ro7 & 0.542602 & 0.042602 & 0.882034 & 598 & 0.542643 \\ {tabular}} {table*},2,RESULT,,evidences,,comparative,low,None,None,None,RO,,,hyphen_count=11; semicolon_count=1; colon_count=1,X covers all eight same-data-X directions and all eight complements; the all64 run02 row is retained as the corresponding final-output repeat context.} tab:redu,QUESTION/FIGURE_TABLE/OBSERVATION/QUANTIFICATION/INTERPRETATION/BOUNDARY,punctuation_issue,SPLIT_SENTENCE
Reduced-XOR Counterfactuals,,REDUCED_XOR_COUNTERFACTUALS.P4,REDUCED_XOR_COUNTERFACTUALS.P4.S1,{table*}[!t] {Reduced-XOR mechanism controls.,1,RESULT,,none,,comparative,none,None,None,None,,,,hyphen_count=1,{table*}[!t] {X mechanism controls.,QUESTION/FIGURE_TABLE/OBSERVATION/QUANTIFICATION/INTERPRETATION/BOUNDARY,none,KEEP
Reduced-XOR Counterfactuals,,REDUCED_XOR_COUNTERFACTUALS.P4,REDUCED_XOR_COUNTERFACTUALS.P4.S2,"The full-direction repeat tests run-to-run stability of the warmup-10 direction map; the second-board rows test cross-board mechanism persistence; the line-direction rows test whether warmup-10 bias is a sampler-phase row failure; the data\_ro3 warmup-neighbor rows test whether the strongest high-biased direction is unique to warmup 10.} tab:reducedxormechanism {tabular}{@{}L{0.20 }L{0.25 }L{0.25 }L{0.22 }@{}} Control & Measured scope & Key values & Mechanism reading \\ Warmup-10 same-data-RO directions & eight $y_{ {ro}i}$ rows & $p_1$ range 0.191877--0.671833; max abs bias 0.308123; min min-H 0.307353 & Strong anisotropy along same-data-RO directions \\ Warmup-10 full direction repeat & eight $y_{ {ro}i}$ and eight $y_{ {except}\ i}$ rows in run01/run02 & data\_ro Pearson 0.999678, mean $| p_1|=0.003199$, same sign 8/8; complements Pearson 0.999013, mean $| p_1|=0.000893$, same sign 8/8 & Repeat-stable anisotropic direction map at warmup 10 \\ Second-board full direction maps & warmup-10 and warmup-11 all64, data\_ro indices 0--7, and except\_ro indices 0--7 & W10 all64 $p_1=0.360614$; except\_ro0, except\_ro2, except\_ro6 near balanced at 0.500015, 0.502798, 0.500649; W11 all64 $p_1=0.473738$ & Same cancellation mechanism appears on a second board, but contributor identities and magnitudes are board specific \\ Second-board held-out sampler W10 & same data-RO matrix and sampled-register island; sample RO moved to X36Y35; all64, data\_ro indices 0--7, except\_ro indices 0--7 & all64 shifts from 0.360614 to 0.500718; held-out data\_ro range 0.273096--0.658159; data\_ro rank Spearman 0.500; sign flips in ro1, ro3, ro4 & Sampler physical context can reorder contributor signs and enable aggregate cancellation without removing biased contributors \\ Warmup-10 sampler-phase line directions & eight $y_{ {line}k}$ rows & $p_1$ range 0.486473--0.501004; max abs bias 0.013527; min min-H 0.961488 & No evidence of a generic sampler-phase line failure in this run \\ Line6 targeted repeat & $y_{ {line}6}$ run01 and repeat02 & $p_1=0.486473$ and 0.487182; worst byte.bit remains 0.3; worst $x=701$ and 714 & Stable fixed-position outlier with weak global bias \\ data\_ro3 warmup neighbors & $y_{ {ro}3}$ and except\_ro3 at warmups 5, 10, 11 & data\_ro3 $p_1=0.576638$, 0.671833, 0.544560; except\_ro3 $p_1=0.503005$, 0.553930, 0.501558 & Direction persists; complement cancellation is warmup-dependent \\ {tabular} {table*}",2,RESULT,,evidences,,comparative,medium,None,None,None,RO;Sampler;ro;sampler,can,high,hyphen_count=40; semicolon_count=19; colon_count=1; slash_count=3; comma_count=21,X full-direction repeat tests run-to-run stability of the warmup-10 direction map; the second-board rows test cross-board mechanism persistence; the line-direct,QUESTION/FIGURE_TABLE/OBSERVATION/QUANTIFICATION/INTERPRETATION/BOUNDARY,unsupported_claim;risk_word;punctuation_issue,ADD_EVIDENCE_ANCHOR;REPLACE_RISK_VERB;SPLIT_SENTENCE
Reduced-XOR Counterfactuals,,REDUCED_XOR_COUNTERFACTUALS.P5,REDUCED_XOR_COUNTERFACTUALS.P5.S1,"{figure}[t] { }{!}{ {tikzpicture}[font= , x=0.43cm, y=4.3cm] (0,0) -- (18.2,0) node[right] {direction}; (0,0) -- (0,0.78) node[above] {$p_1$}; / in {0/0,0.25/0.25,0.5/0.5,0.75/0.75} { (-0.08, ) -- (0, ) node[left] { }; } (0,0.5) -- (18.0,0.5); (0.77,0) rectangle (1.23,0.458617); (1.77,0) rectangle (2.23,0.191877); (2.77,0) rectangle (3.23,0.518915); (3.77,0) rectangle (4.23,0.244002); (4.77,0) rectangle (5.23,0.671833); (5.77,0) rectangle (6.23,0.424639); (6.77,0) rectangle (7.23,0.409454); (7.77,0) rectangle (8.23,0.375380); (8.77,0) rectangle (9.23,0.549958); (9.77,0) rectangle (10.23,0.501020); (10.77,0) rectangle (11.23,0.550312); (11.77,0) rectangle (12.23,0.499674); (12.77,0) rectangle (13.23,0.553930); (13.77,0) rectangle (14.23,0.520205); (14.77,0) rectangle (15.23,0.565521); (15.77,0) rectangle (16.23,0.501833); (16.77,0) rectangle (17.23,0.542602); at (1,-0.025) {all64}; at (2,-0.025) {ro0}; at (3,-0.025) {ro1}; at (4,-0.025) {ro2}; at (5,-0.025) {ro3}; at (6,-0.025) {ro4}; at (7,-0.025) {ro5}; at (8,-0.025) {ro6}; at (9,-0.025) {ro7}; at (10,-0.025) {ex0}; at (11,-0.025) {ex1}; at (12,-0.025) {ex2}; at (13,-0.025) {ex3}; at (14,-0.025) {ex4}; at (15,-0.025) {ex5}; at (16,-0.025) {ex6}; at (17,-0.025) {ex7}; at (17.95,0.61) {$p_1=0.5$}; at (1.5,0.72) {same-data-RO group}; at (10.0,0.72) {complement group}; {tikzpicture}} {Warmup-10 reduced-XOR $p_1$ values for the complete run01 direction map.",1,RESULT,,none,,comparative,low,None,None,None,RO,,,hyphen_count=26; semicolon_count=41; parentheses_count=124; slash_count=5; comma_count=67,"{figure}[t] { }{!}{ {tikzpicture}[font= , x=0.43cm, y=4.3cm] (0,0) -- (18.2,0) node[right] {direction}; (0,0) -- (0,0.78) node[above] {$p_1$}; / in {0/0,0.25/0.",QUESTION/FIGURE_TABLE/OBSERVATION/QUANTIFICATION/INTERPRETATION/BOUNDARY,punctuation_issue,SPLIT_SENTENCE
Reduced-XOR Counterfactuals,,REDUCED_XOR_COUNTERFACTUALS.P5,REDUCED_XOR_COUNTERFACTUALS.P5.S2,The left group contains all64 followed by same-data-RO directions; the right group contains complements.,2,BG,,elaborates,,descriptive,low,None,None,None,RO,,,hyphen_count=2; semicolon_count=1,X left group contains all64 followed by same-data-X directions; the right group contains complements.,QUESTION/FIGURE_TABLE/OBSERVATION/QUANTIFICATION/INTERPRETATION/BOUNDARY,punctuation_issue;role_mismatch,SPLIT_SENTENCE;REFUNCTION_SENTENCE;REORDER_SENTENCE
Reduced-XOR Counterfactuals,,REDUCED_XOR_COUNTERFACTUALS.P5,REDUCED_XOR_COUNTERFACTUALS.P5.S3,Bar patterns distinguish the groups for grayscale viewing.} fig:reducedxor {figure},3,RESULT,,evidences,,comparative,low,None,None,None,,,,colon_count=1,X patterns distinguish the groups for grayscale viewing.} fig:reducedxor {figure},QUESTION/FIGURE_TABLE/OBSERVATION/QUANTIFICATION/INTERPRETATION/BOUNDARY,none,KEEP
Reduced-XOR Counterfactuals,,REDUCED_XOR_COUNTERFACTUALS.P6,REDUCED_XOR_COUNTERFACTUALS.P6.S1,The mechanism controls in Table tab:reducedxormechanism sharpen the interpretation.,1,RESULT,,none,,comparative,low,Table,None,Table tab:reducedxormechanism,,,,colon_count=1,X mechanism controls in X tab:reducedxormechanism sharpen the interpretation.,QUESTION/FIGURE_TABLE/OBSERVATION/QUANTIFICATION/INTERPRETATION/BOUNDARY,none,KEEP
Reduced-XOR Counterfactuals,,REDUCED_XOR_COUNTERFACTUALS.P6,REDUCED_XOR_COUNTERFACTUALS.P6.S2,"The warmup-10 sampled vector is strongly anisotropic and repeat-stable: across the complete run01/run02 direction map, same-data-RO directions have Pearson correlation 0.999678 in $p_1$, mean absolute run-to-run change 0.003199, and the same bias sign in all eight directions.",2,BG,,jumps,,causal/generalization,low,None,None,None,RO,,,hyphen_count=6; colon_count=1; slash_count=1; comma_count=3,"X warmup-10 sampled vector is strongly anisotropic and repeat-stable: across the complete run01/run02 direction map, same-data-X directions have X correlation 0",QUESTION/FIGURE_TABLE/OBSERVATION/QUANTIFICATION/INTERPRETATION/BOUNDARY,sentence_jump;role_mismatch,ADD_BRIDGE;REFUNCTION_SENTENCE;REORDER_SENTENCE
Reduced-XOR Counterfactuals,,REDUCED_XOR_COUNTERFACTUALS.P6,REDUCED_XOR_COUNTERFACTUALS.P6.S3,"The complement directions show the same qualitative stability with Pearson correlation 0.999013, mean absolute change 0.000893, and matching bias signs in all eight directions.",3,RESULT,,elaborates,,causal/generalization,medium,None,None,None,,,,comma_count=2,"X complement directions show the same qualitative stability with X correlation 0.999013, mean absolute change 0.000893, and matching bias signs in all eight dir",QUESTION/FIGURE_TABLE/OBSERVATION/QUANTIFICATION/INTERPRETATION/BOUNDARY,unsupported_claim,ADD_EVIDENCE_ANCHOR
Reduced-XOR Counterfactuals,,REDUCED_XOR_COUNTERFACTUALS.P6,REDUCED_XOR_COUNTERFACTUALS.P6.S4,"In contrast, sampler-phase line directions remain close to balance, spanning $p_1=0.486473$ to 0.501004.",4,GAP,,contrasts,,descriptive,low,None,None,None,sampler,,,hyphen_count=1; comma_count=2,"X contrast, sampler-phase line directions remain close to balance, spanning $p_1=0.486473$ to 0.501004.",QUESTION/FIGURE_TABLE/OBSERVATION/QUANTIFICATION/INTERPRETATION/BOUNDARY,role_mismatch,REFUNCTION_SENTENCE;REORDER_SENTENCE
Reduced-XOR Counterfactuals,,REDUCED_XOR_COUNTERFACTUALS.P6,REDUCED_XOR_COUNTERFACTUALS.P6.S5,Thus the dominant marginal reduced-XOR structure in this run is not a generic failure of one sampler phase line.,5,BG,,interprets,,comparative,low,None,None,None,sampler,,,hyphen_count=1,X the dominant marginal reduced-X structure in this run is not a generic failure of one sampler phase line.,QUESTION/FIGURE_TABLE/OBSERVATION/QUANTIFICATION/INTERPRETATION/BOUNDARY,role_mismatch,REFUNCTION_SENTENCE;REORDER_SENTENCE
Reduced-XOR Counterfactuals,,REDUCED_XOR_COUNTERFACTUALS.P6,REDUCED_XOR_COUNTERFACTUALS.P6.S6,It is concentrated in same-data-RO directions and then reshaped by XOR complements.,6,BG,,jumps,,descriptive,low,None,None,None,RO,,,hyphen_count=2,X is concentrated in same-data-X directions and then reshaped by X complements.,QUESTION/FIGURE_TABLE/OBSERVATION/QUANTIFICATION/INTERPRETATION/BOUNDARY,sentence_jump;role_mismatch,ADD_BRIDGE;REFUNCTION_SENTENCE;REORDER_SENTENCE
Reduced-XOR Counterfactuals,,REDUCED_XOR_COUNTERFACTUALS.P7,REDUCED_XOR_COUNTERFACTUALS.P7.S1,The second-board reduced-XOR check reinforces this mechanism without implying identical board behavior.,1,BG,,none,,comparative,low,None,None,None,,,,hyphen_count=2,X second-board reduced-X check reinforces this mechanism without implying identical board behavior.,QUESTION/FIGURE_TABLE/OBSERVATION/QUANTIFICATION/INTERPRETATION/BOUNDARY,role_mismatch,REFUNCTION_SENTENCE;REORDER_SENTENCE
Reduced-XOR Counterfactuals,,REDUCED_XOR_COUNTERFACTUALS.P7,REDUCED_XOR_COUNTERFACTUALS.P7.S2,"At warmup 10, the second-board all64 output is biased low ($p_1=0.360614$), while removing data\_ro0, data\_ro2, or data\_ro6 nearly balances the stream ($p_1=0.500015$, 0.502798, and 0.500649).",2,BG,,elaborates,,descriptive,low,None,None,None,,,low,hyphen_count=1; parentheses_count=4; comma_count=6,"X warmup 10, the second-board all64 output is biased low ($p_1=0.360614$), while removing data\_ro0, data\_ro2, or data\_ro6 nearly balances the stream ($p_1=0.",QUESTION/FIGURE_TABLE/OBSERVATION/QUANTIFICATION/INTERPRETATION/BOUNDARY,risk_word;punctuation_issue;role_mismatch,REPLACE_RISK_VERB;SPLIT_SENTENCE;REFUNCTION_SENTENCE;REORDER_SENTENCE
Reduced-XOR Counterfactuals,,REDUCED_XOR_COUNTERFACTUALS.P7,REDUCED_XOR_COUNTERFACTUALS.P7.S3,"At warmup 11, all64 moves closer to balance ($p_1=0.473738$), but individual same-data-RO contributors remain strongly biased; near-balanced removal cases shift to except\_ro3, except\_ro6, and except\_ro1.",3,GAP,,elaborates,,descriptive,low,None,None,None,RO,,,hyphen_count=3; semicolon_count=1; parentheses_count=2; comma_count=4,"X warmup 11, all64 moves closer to balance ($p_1=0.473738$), but individual same-data-X contributors remain strongly biased; near-balanced removal cases shift t",QUESTION/FIGURE_TABLE/OBSERVATION/QUANTIFICATION/INTERPRETATION/BOUNDARY,punctuation_issue;role_mismatch,SPLIT_SENTENCE;REFUNCTION_SENTENCE;REORDER_SENTENCE
Reduced-XOR Counterfactuals,,REDUCED_XOR_COUNTERFACTUALS.P7,REDUCED_XOR_COUNTERFACTUALS.P7.S4,"This is consistent with the same warmup-dependent signed-contributor model observed on the primary board, with board-specific contributor identities and magnitudes.",4,RESULT,,jumps,,measurement,low,None,None,None,,consistent,,hyphen_count=3; comma_count=1,"X is consistent with the same warmup-dependent signed-contributor model observed on the primary board, with board-specific contributor identities and magnitudes",QUESTION/FIGURE_TABLE/OBSERVATION/QUANTIFICATION/INTERPRETATION/BOUNDARY,sentence_jump,ADD_BRIDGE
Reduced-XOR Counterfactuals,,REDUCED_XOR_COUNTERFACTUALS.P8,REDUCED_XOR_COUNTERFACTUALS.P8.S1,The second-board held-out sampler experiment adds a stronger physical-context check.,1,SETUP,,none,,descriptive,low,Experiment setup,None,None,sampler,,,hyphen_count=3,X second-board held-out sampler experiment adds a stronger physical-context check.,QUESTION/FIGURE_TABLE/OBSERVATION/QUANTIFICATION/INTERPRETATION/BOUNDARY,role_mismatch,REFUNCTION_SENTENCE;REORDER_SENTENCE
Reduced-XOR Counterfactuals,,REDUCED_XOR_COUNTERFACTUALS.P8,REDUCED_XOR_COUNTERFACTUALS.P8.S2,"It keeps the random1 data-RO matrix and sampled-register island, but moves the sample RO to the held-out X36Y35 context.",2,BG,,elaborates,,descriptive,low,None,None,None,RO,,,hyphen_count=3; comma_count=1,"X keeps the random1 data-X matrix and sampled-register island, but moves the sample X to the held-out X context.",QUESTION/FIGURE_TABLE/OBSERVATION/QUANTIFICATION/INTERPRETATION/BOUNDARY,role_mismatch,REFUNCTION_SENTENCE;REORDER_SENTENCE
Reduced-XOR Counterfactuals,,REDUCED_XOR_COUNTERFACTUALS.P8,REDUCED_XOR_COUNTERFACTUALS.P8.S3,"Under this sampler context, warmup-10 all64 changes from the original second-board value $p_1=0.360614$ to 0.500718 with Min-H 0.997930.",3,BOUNDARY,,elaborates,,causal/generalization,low,None,None,None,sampler,under,,hyphen_count=3; comma_count=1,"X this sampler context, warmup-10 all64 changes from the original second-board value $p_1=0.360614$ to 0.500718 with X 0.997930.",QUESTION/FIGURE_TABLE/OBSERVATION/QUANTIFICATION/INTERPRETATION/BOUNDARY,none,ADD_BOUNDARY
Reduced-XOR Counterfactuals,,REDUCED_XOR_COUNTERFACTUALS.P8,REDUCED_XOR_COUNTERFACTUALS.P8.S4,"The full reduced-XOR map shows that this aggregate balance does not mean the internal contributors became unbiased: held-out same-data-RO directions span $p_1=0.273096$ to 0.658159, while complements except\_ro1, except\_ro3, except\_ro4, except\_ro5, except\_ro6, and except\_ro7 are all near 0.5.",4,RESULT,,jumps,,comparative,medium,None,None,None,RO,,,hyphen_count=4; colon_count=1; comma_count=6,X full reduced-X map shows that this aggregate balance does not mean the internal contributors became unbiased: held-out same-data-X directions span $p_1=0.2730,QUESTION/FIGURE_TABLE/OBSERVATION/QUANTIFICATION/INTERPRETATION/BOUNDARY,sentence_jump;unsupported_claim;punctuation_issue,ADD_BRIDGE;ADD_EVIDENCE_ANCHOR;SPLIT_SENTENCE
Reduced-XOR Counterfactuals,,REDUCED_XOR_COUNTERFACTUALS.P8,REDUCED_XOR_COUNTERFACTUALS.P8.S5,"The data-RO ordering is only partially preserved relative to the original W10 context (Spearman 0.500), and ro1, ro3, and ro4 flip signed bias.",5,BG,,jumps,,descriptive,low,None,None,None,RO,,,hyphen_count=1; parentheses_count=2; comma_count=3,"X data-X ordering is only partially preserved relative to the original X context (X 0.500), and ro1, ro3, and ro4 flip signed bias.",QUESTION/FIGURE_TABLE/OBSERVATION/QUANTIFICATION/INTERPRETATION/BOUNDARY,sentence_jump;role_mismatch,ADD_BRIDGE;REFUNCTION_SENTENCE;REORDER_SENTENCE
Reduced-XOR Counterfactuals,,REDUCED_XOR_COUNTERFACTUALS.P8,REDUCED_XOR_COUNTERFACTUALS.P8.S6,This supports a sampler-context and local-routed-interaction interpretation rather than a fixed intrinsic ranking of data ROs alone.,6,BG,,jumps,,descriptive,medium,None,None,None,sampler,,,hyphen_count=3,X supports a sampler-context and local-routed-interaction interpretation rather than a fixed intrinsic ranking of data X alone.,QUESTION/FIGURE_TABLE/OBSERVATION/QUANTIFICATION/INTERPRETATION/BOUNDARY,sentence_jump;unsupported_claim;role_mismatch,ADD_BRIDGE;ADD_EVIDENCE_ANCHOR;REFUNCTION_SENTENCE;REORDER_SENTENCE
Reduced-XOR Counterfactuals,,REDUCED_XOR_COUNTERFACTUALS.P9,REDUCED_XOR_COUNTERFACTUALS.P9.S1,A simple independence XOR approximation is useful only as an interpretive check.,1,BG,,none,,descriptive,low,None,None,None,,,,,X simple independence X approximation is useful only as an interpretive check.,QUESTION/FIGURE_TABLE/OBSERVATION/QUANTIFICATION/INTERPRETATION/BOUNDARY,role_mismatch,REFUNCTION_SENTENCE;REORDER_SENTENCE
Reduced-XOR Counterfactuals,,REDUCED_XOR_COUNTERFACTUALS.P9,REDUCED_XOR_COUNTERFACTUALS.P9.S2,"Using marginal contributor probabilities, it predicts a primary-board all64 value near 0.500001 for a case measured at 0.458617, leaving a residual consistent with correlation, fixed-position restart structure, or unmodeled sampler-aperture effects.",2,RESULT,,jumps,,measurement,low,None,None,None,restart;sampler,consistent,,hyphen_count=3; comma_count=4,"X marginal contributor probabilities, it predicts a primary-board all64 value near 0.500001 for a case measured at 0.458617, leaving a residual consistent with ",QUESTION/FIGURE_TABLE/OBSERVATION/QUANTIFICATION/INTERPRETATION/BOUNDARY,sentence_jump;punctuation_issue,ADD_BRIDGE;SPLIT_SENTENCE
Reduced-XOR Counterfactuals,,REDUCED_XOR_COUNTERFACTUALS.P9,REDUCED_XOR_COUNTERFACTUALS.P9.S3,"For the second-board held-out sampler aggregate, the same approximation predicts 0.499997 versus measured 0.500718.",3,RESULT,,elaborates,,measurement,low,None,None,None,sampler,,,hyphen_count=2; comma_count=1,"X the second-board held-out sampler aggregate, the same approximation predicts 0.499997 versus measured 0.500718.",QUESTION/FIGURE_TABLE/OBSERVATION/QUANTIFICATION/INTERPRETATION/BOUNDARY,none,KEEP
Reduced-XOR Counterfactuals,,REDUCED_XOR_COUNTERFACTUALS.P9,REDUCED_XOR_COUNTERFACTUALS.P9.S4,"The contrast reinforces the caution that XOR cancellation may sometimes be approximated from marginals, but the paper does not use this approximation as calibrated physical proof.",4,BG,,elaborates,,descriptive,medium,None,None,None,,may,,comma_count=1,"X contrast reinforces the caution that X cancellation may sometimes be approximated from marginals, but the paper does not use this approximation as calibrated ",QUESTION/FIGURE_TABLE/OBSERVATION/QUANTIFICATION/INTERPRETATION/BOUNDARY,unsupported_claim;role_mismatch,ADD_EVIDENCE_ANCHOR;REFUNCTION_SENTENCE;REORDER_SENTENCE
Reduced-XOR Counterfactuals,,REDUCED_XOR_COUNTERFACTUALS.P10,REDUCED_XOR_COUNTERFACTUALS.P10.S1,Additional mechanism-validation artifacts from the TVLSI track were folded back into this TIM boundary diagnosis as bounded evidence rather than as a separate physical model.,1,BG,,none,,descriptive,low,None,None,None,,,,hyphen_count=1,X mechanism-validation artifacts from the X track were folded back into this X boundary diagnosis as bounded evidence rather than as a separate physical model.,QUESTION/FIGURE_TABLE/OBSERVATION/QUANTIFICATION/INTERPRETATION/BOUNDARY,role_mismatch,REFUNCTION_SENTENCE;REORDER_SENTENCE
Reduced-XOR Counterfactuals,,REDUCED_XOR_COUNTERFACTUALS.P10,REDUCED_XOR_COUNTERFACTUALS.P10.S2,Table tab:tvlsimechanism summarizes the checks.,2,RESULT,,evidences,,descriptive,none,Table,None,Table tab:tvlsimechanism,,,,colon_count=1,X tab:tvlsimechanism summarizes the checks.,QUESTION/FIGURE_TABLE/OBSERVATION/QUANTIFICATION/INTERPRETATION/BOUNDARY,none,KEEP
Reduced-XOR Counterfactuals,,REDUCED_XOR_COUNTERFACTUALS.P10,REDUCED_XOR_COUNTERFACTUALS.P10.S3,"The second held-out {sample\_ro\_local} context adds a 10-point anchor warmup sweep over the all64 aggregate (archived as {all640}), data\_ro0, and data\_ro4.",3,BG,,jumps,,descriptive,low,None,None,None,,,,hyphen_count=2; parentheses_count=2; comma_count=2,"X second held-out {sample\_ro\_local} context adds a 10-point anchor warmup sweep over the all64 aggregate (archived as {all640}), data\_ro0, and data\_ro4.",QUESTION/FIGURE_TABLE/OBSERVATION/QUANTIFICATION/INTERPRETATION/BOUNDARY,sentence_jump;role_mismatch,ADD_BRIDGE;REFUNCTION_SENTENCE;REORDER_SENTENCE
Reduced-XOR Counterfactuals,,REDUCED_XOR_COUNTERFACTUALS.P10,REDUCED_XOR_COUNTERFACTUALS.P10.S4,"The all64 aggregate moves from a biased warmup-8 point with absolute bias 0.180194 to a near-balanced warmup-9 point with absolute bias 0.000337, and data\_ro4 changes signed-bias direction three times across the observed warmups.",4,RESULT,,elaborates,,causal/generalization,low,None,None,None,,,,hyphen_count=4; comma_count=1,"X all64 aggregate moves from a biased warmup-8 point with absolute bias 0.180194 to a near-balanced warmup-9 point with absolute bias 0.000337, and data\_ro4 ch",QUESTION/FIGURE_TABLE/OBSERVATION/QUANTIFICATION/INTERPRETATION/BOUNDARY,none,KEEP
Reduced-XOR Counterfactuals,,REDUCED_XOR_COUNTERFACTUALS.P10,REDUCED_XOR_COUNTERFACTUALS.P10.S5,"This is mechanism-consistent startup/aperture evidence for selected anchors, not a full-map warmup sweep.",5,INTERPRETATION,,jumps,,descriptive,low,None,None,None,,consistent,,hyphen_count=2; slash_count=1; comma_count=1,"X is mechanism-consistent startup/aperture evidence for selected anchors, not a full-map warmup sweep.",QUESTION/FIGURE_TABLE/OBSERVATION/QUANTIFICATION/INTERPRETATION/BOUNDARY,sentence_jump;role_mismatch,ADD_BRIDGE;REFUNCTION_SENTENCE;REORDER_SENTENCE;ADD_BOUNDARY
Reduced-XOR Counterfactuals,,REDUCED_XOR_COUNTERFACTUALS.P11,REDUCED_XOR_COUNTERFACTUALS.P11.S1,{table*}[t] {Additional TVLSI-track mechanism checks imported into the TIM boundary argument.,1,RESULT,,none,,descriptive,low,None,None,None,,,,hyphen_count=1,{table*}[t] {X X mechanism checks imported into the X boundary argument.,QUESTION/FIGURE_TABLE/OBSERVATION/QUANTIFICATION/INTERPRETATION/BOUNDARY,none,KEEP
